Name,Description,Price,Category,Subcategory,Stock,Brand
Paracetamol Tablets,Effective pain relief tablets that also help reduce fever providing quick relief from discomfort and aiding recovery,50,Medicine,Pain Relief,100,HealthCare Solutions
Ibuprofen Tablets,These tablets provide excellent pain relief and help reduce inflammation for various conditions ensuring you feel better fast,60,Medicine,Pain Relief,150,Wellness Essentials
Cough Syrup,Our cough syrup soothes throat irritation and provides relief from persistent coughing helping you breathe easier and recover quickly,70,Medicine,Cough & Cold,200,Nature's Cure
Antibiotic Cream,This cream treats minor skin infections effectively and helps speed up the healing process for cuts and scrapes,80,Medicine,First Aid,120,Medicare Plus
Aspirin Tablets,Aspirin tablets are perfect for reducing pain and fever providing quick and effective relief from various ailments,40,Medicine,Pain Relief,180,HealthCare Solutions
Vitamin C Tablets,Boost your immune system with these Vitamin C tablets which provide essential nutrients to keep you healthy and energized,100,Wellness,Supplements,250,Wellness Essentials
Multivitamin Capsules,These capsules provide essential vitamins and minerals to support overall health and well-being keeping you energized daily,150,Wellness,Supplements,200,Nature's Cure
Probiotic Supplements,Support your digestive health with these probiotic supplements that promote a balanced gut flora and improve digestion,200,Wellness,Supplements,150,Medicare Plus
Green Tea,Rich in antioxidants our green tea provides numerous health benefits and helps you stay refreshed and rejuvenated throughout the day,50,Wellness,Herbal,300,HealthCare Solutions
Omega-3 Fish Oil,Supports heart health and overall well-being with these Omega-3 fish oil capsules rich in essential fatty acids,400,Wellness,Supplements,150,Wellness Essentials
Face Wash,This face wash cleanses and refreshes your skin leaving it feeling soft smooth and rejuvenated after each use,80,Beauty,Skincare,300,Nature's Cure
Moisturizer,Hydrate and nourish your skin with this effective moisturizer which keeps your skin soft and supple throughout the day,100,Beauty,Skincare,250,Medicare Plus
Sunscreen,Protect your skin from harmful UV rays with our sunscreen that offers broad-spectrum protection and keeps your skin healthy,120,Beauty,Skincare,200,HealthCare Solutions
Lip Balm,Moisturize and protect your lips with our lip balm keeping them soft smooth and healthy even in harsh weather,50,Beauty,Skincare,400,Wellness Essentials
Hair Shampoo,This shampoo cleanses and strengthens your hair providing a healthy shine and improving overall hair health,150,Beauty,Haircare,180,Nature's Cure
Baby Lotion,Gentle moisturizer for baby skin that keeps it soft and hydrated suitable for daily use on delicate skin,60,Baby Care,Skincare,300,Medicare Plus
Diaper Rash Cream,Soothes and protects baby's skin from diaper rash providing quick relief and promoting healing,70,Baby Care,Skincare,200,HealthCare Solutions
Baby Shampoo,Mild and gentle on baby hair this shampoo cleanses effectively without causing irritation or dryness,90,Baby Care,Haircare,180,Wellness Essentials
Baby Powder,Keeps baby skin dry and fresh with our talc-free baby powder perfect for daily use,50,Baby Care,Hygiene,250,Nature's Cure
Infant Formula,Nutritional supplement for babies providing essential nutrients for healthy growth and development,400,Baby Care,Nutrition,100,Medicare Plus
Cold and Flu Capsules,Relieve cold and flu symptoms effectively with these capsules helping you recover faster and feel better,120,Health Condition,Cough & Cold,150,HealthCare Solutions
Allergy Relief Tablets,Reduces allergy symptoms and provides quick relief from sneezing runny nose and itching,80,Health Condition,Allergy,200,Wellness Essentials
Antacid Tablets,Relieve heartburn and indigestion with our fast-acting antacid tablets keeping you comfortable,60,Health Condition,Digestion,180,Nature's Cure
Blood Pressure Monitor,Monitors blood pressure levels accurately and provides readings to help manage your health effectively,1200,Health Condition,Monitoring,30,Medicare Plus
Glucose Monitor,Tracks blood sugar levels accurately helping you manage your diabetes and stay healthy,2500,Health Condition,Monitoring,20,HealthCare Solutions
Protein Powder,Supports muscle growth and recovery with our high-quality protein powder ideal for fitness enthusiasts,800,Fitness,Nutrition,150,Wellness Essentials
Dumbbells,Strength training weights perfect for building muscle and improving overall fitness,1200,Fitness,Equipment,50,Nature's Cure
Yoga Mat,Provides comfort and support during yoga and other exercise routines ensuring a great workout experience,500,Fitness,Accessories,100,Medicare Plus
Resistance Bands,For strength training exercises these resistance bands are versatile and easy to use for various workouts,300,Fitness,Accessories,200,HealthCare Solutions
Treadmill,Indoor running and walking machine that helps you stay fit and active at home,15000,Fitness,Equipment,10,Wellness Essentials
Hand Sanitizer,Kills 99.9% of germs and bacteria keeping your hands clean and protected throughout the day,45,Personal Hygiene,Hygiene,500,Nature's Cure
Toothpaste,Promotes oral hygiene with our fluoride toothpaste which helps prevent cavities and keeps your breath fresh,60,Personal Hygiene,Dental Care,400,Medicare Plus
Toothbrush,Cleans teeth and gums effectively with our soft-bristled toothbrush suitable for daily use,20,Personal Hygiene,Dental Care,600,HealthCare Solutions
Shaving Cream,For a smooth shave our shaving cream provides excellent lubrication and prevents irritation,80,Personal Hygiene,Shaving,300,Wellness Essentials
Razor Blades,Provides a close shave with our sharp and durable razor blades ensuring a comfortable shaving experience,100,Personal Hygiene,Shaving,400,Nature's Cure
Vitamin D3 Capsules,Boosts immune system and bone health with our Vitamin D3 capsules essential for overall well-being,200,Wellness,Supplements,200,Medicare Plus
Zinc Supplements,Supports immune function and overall health with our high-quality zinc supplements,150,Wellness,Supplements,180,HealthCare Solutions
Calcium Tablets,Strengthens bones and teeth with our calcium tablets essential for maintaining bone health,120,Wellness,Supplements,250,Wellness Essentials
Herbal Tea,Natural remedy for relaxation our herbal tea helps you unwind and destress after a long day,60,Wellness,Herbal,300,Nature's Cure
Aloe Vera Gel,Soothes skin and promotes healing with our pure aloe vera gel perfect for burns and minor cuts,100,Wellness,Herbal,200,Medicare Plus
Anti-Dandruff Shampoo,Treats dandruff and itchy scalp effectively with our specially formulated anti-dandruff shampoo,180,Beauty,Haircare,150,HealthCare Solutions
Hair Conditioner,Nourishes and detangles hair leaving it soft smooth and manageable after every wash,120,Beauty,Haircare,200,Wellness Essentials
Facial Scrub,Exfoliates and smoothens skin removing dead cells and impurities for a radiant complexion,90,Beauty,Skincare,180,Nature's Cure
Eye Cream,Reduces dark circles and puffiness around the eyes giving you a refreshed and youthful appearance,200,Beauty,Skincare,150,Medicare Plus
Nail Polish,Colorful and glossy nail finish our nail polish provides long-lasting color and shine,50,Beauty,Makeup,250,HealthCare Solutions
Baby Wipes,Soft and gentle cleaning wipes for babies perfect for everyday use on sensitive skin,70,Baby Care,Hygiene,300,Wellness Essentials
Baby Bottle,Safe and easy feeding bottle for babies designed to reduce colic and ensure comfortable feeding,120,Baby Care,Feeding,150,Nature's Cure
Baby Pacifier,Soothes and comforts babies with our BPA-free pacifier perfect for newborns and infants,40,Baby Care,Feeding,250,Medicare Plus
Teething Gel,Relieves teething pain and discomfort in babies helping them feel more comfortable during teething,60,Baby Care,Skincare,200,HealthCare Solutions
Baby Blanket,Soft and cozy baby blanket perfect for keeping your little one warm and comfortable,200,Baby Care,Accessories,100,Wellness Essentials
Cold Sore Treatment,Reduces cold sore duration and provides relief from discomfort helping you heal faster,100,Health Condition,Cold & Flu,150,Nature's Cure
Antifungal Cream,Treats fungal infections effectively providing relief from itching and irritation,80,Health Condition,Skin,200,Medicare Plus
Heartburn Relief,Relieves heartburn symptoms quickly providing fast-acting relief from discomfort,70,Health Condition,Digestion,180,HealthCare Solutions
Inhaler,Relieves asthma symptoms effectively helping you breathe easier and manage your condition,400,Health Condition,Respiratory,50,Wellness Essentials
Cholesterol Test Kit,Tracks cholesterol levels accurately helping you manage your heart health effectively,1500,Health Condition,Monitoring,30,Nature's Cure
BCAA Powder,Supports muscle recovery and growth with our high-quality BCAA powder perfect for post-workout consumption,600,Fitness,Nutrition,100,Medicare Plus
Jump Rope,For cardio exercises our jump rope is durable and adjustable providing an effective workout,200,Fitness,Accessories,200,HealthCare Solutions
Pull-Up Bar,Strength training bar perfect for home workouts and building upper body strength,800,Fitness,Equipment,50,Wellness Essentials
Kettlebells,Strength training weights ideal for various workouts and improving overall fitness,1000,Fitness,Equipment,60,Nature's Cure
Exercise Bike,Indoor cycling machine that provides an effective cardio workout helping you stay fit,10000,Fitness,Equipment,15,Medicare Plus
Feminine Wash,Gentle and effective intimate care wash that maintains pH balance and ensures freshness,80,Personal Hygiene,Hygiene,200,HealthCare Solutions
Deodorant,Provides long-lasting freshness and odor protection with our effective deodorant,60,Personal Hygiene,Hygiene,300,Wellness Essentials
Shower Gel,Cleanses and refreshes skin leaving it soft and smooth after every shower,90,Personal Hygiene,Hygiene,250,Nature's Cure
Mouthwash,Promotes oral hygiene with our effective mouthwash that helps reduce plaque and freshen breath,70,Personal Hygiene,Dental Care,200,Medicare Plus
Electric Toothbrush,Effective teeth cleaning with our electric toothbrush designed to remove plaque and improve oral health,300,Personal Hygiene,Dental Care,100,HealthCare Solutions
Iron Supplements,Prevents and treats iron deficiency with our high-quality iron supplements supporting overall health,180,Wellness,Supplements,150,Wellness Essentials
Magnesium Tablets,Supports muscle and nerve function with our magnesium tablets essential for overall health,160,Wellness,Supplements,180,Nature's Cure
Echinacea Capsules,Boosts immune system with our echinacea capsules helping you stay healthy and fight off infections,120,Wellness,Herbal,200,Medicare Plus
Chamomile Tea,Promotes relaxation and sleep with our chamomile tea perfect for unwinding after a long day,50,Wellness,Herbal,250,HealthCare Solutions
Turmeric Capsules,Anti-inflammatory benefits with our turmeric capsules supporting overall health and well-being,140,Wellness,Herbal,180,Wellness Essentials
Anti-Aging Cream,Reduces signs of aging with our anti-aging cream leaving your skin looking youthful and radiant,300,Beauty,Skincare,120,Nature's Cure
Makeup Remover,Gently removes makeup without irritating your skin leaving it clean and refreshed,90,Beauty,Skincare,200,Medicare Plus
Liquid Foundation,Provides smooth and even skin tone with our long-lasting liquid foundation perfect for all-day wear,200,Beauty,Makeup,150,HealthCare Solutions
Mascara,Enhances eyelashes with our volumizing mascara giving you a bold and dramatic look,120,Beauty,Makeup,180,Wellness Essentials
Blush,Adds color to cheeks with our natural-looking blush perfect for a healthy glow,100,Beauty,Makeup,200,Nature's Cure
Baby Oil,Moisturizes and soothes baby skin with our gentle baby oil perfect for daily use,50,Baby Care,Skincare,300,Medicare Plus
Baby Hair Brush,Gentle on baby's scalp our soft-bristled baby hair brush ensures comfortable grooming,30,Baby Care,Accessories,200,HealthCare Solutions
Baby Swaddle,Comfortable and secure swaddling with our soft baby swaddle perfect for newborns,150,Baby Care,Accessories,100,Wellness Essentials
Diapers,High absorbency and leak protection with our diapers keeping your baby dry and comfortable,300,Baby Care,Hygiene,150,Nature's Cure
Baby Food,Nutritional baby food that provides essential nutrients for healthy growth and development,250,Baby Care,Nutrition,120,Medicare Plus
Cough Lozenges,Soothes sore throat and provides relief from coughing with our effective cough lozenges,60,Health Condition,Cough & Cold,200,HealthCare Solutions
Eczema Cream,Treats eczema symptoms effectively with our specially formulated cream providing relief from itching and irritation,150,Health Condition,Skin,100,Wellness Essentials
Constipation Relief,Relieves constipation and promotes regular bowel movements with our gentle laxative tablets,80,Health Condition,Digestion,150,Nature's Cure
Nasal Spray,Clears nasal congestion and helps you breathe easier with our fast-acting nasal spray,90,Health Condition,Respiratory,180,Medicare Plus
Digital Thermometer,Measures body temperature accurately with our digital thermometer providing quick and reliable readings,150,Health Condition,Monitoring,50,HealthCare Solutions
Creatine Powder,Enhances muscle strength and performance with our high-quality creatine powder ideal for fitness enthusiasts,500,Fitness,Nutrition,150,Wellness Essentials
Exercise Ball,For stability and core exercises our durable exercise ball is perfect for various workouts,400,Fitness,Accessories,100,Nature's Cure
Weightlifting Belt,Supports lower back during lifts with our sturdy weightlifting belt perfect for strength training,600,Fitness,Accessories,80,Medicare Plus
Rowing Machine,Full-body workout machine that provides an effective cardiovascular workout helping you stay fit,12000,Fitness,Equipment,10,HealthCare Solutions
Elliptical Trainer,Low-impact cardio machine that provides an effective workout without putting stress on joints,20000,Fitness,Equipment,8,Wellness Essentials
Hand Wash,Kills germs and bacteria keeping your hands clean and protected with our effective hand wash,40,Personal Hygiene,Hygiene,500,Nature's Cure
Body Lotion,Moisturizes and nourishes skin with our body lotion leaving it soft smooth and hydrated,70,Personal Hygiene,Hygiene,300,Medicare Plus
Hand Cream,Hydrates and softens hands with our nourishing hand cream perfect for daily use,60,Personal Hygiene,Hygiene,250,HealthCare Solutions
Foot Cream,Softens and heals cracked feet with our intensive foot cream providing relief from dryness,80,Personal Hygiene,Hygiene,200,Wellness Essentials
Hair Oil,Nourishes and strengthens hair with our hair oil promoting healthy and shiny hair,120,Personal Hygiene,Haircare,180,Nature's Cure
Folic Acid Tablets,Supports prenatal health with our folic acid tablets essential for pregnant women,100,Wellness,Supplements,150,Medicare Plus
Ginkgo Biloba Capsules,Enhances cognitive function and memory with our ginkgo biloba capsules supporting brain health,200,Wellness,Herbal,100,HealthCare Solutions
Lavender Oil,Promotes relaxation and stress relief with our pure lavender oil perfect for aromatherapy,150,Wellness,Herbal,120,Wellness Essentials
Rosehip Oil,Nourishes and rejuvenates skin with our pure rosehip oil rich in essential fatty acids,180,Wellness,Herbal,110,Nature's Cure
Ginseng Capsules,Boosts energy and vitality with our ginseng capsules supporting overall health and well-being,250,Wellness,Herbal,80,Medicare Plus
